案件タイトル,案件URL,案件概要,案件本文,募集形式,カテゴリ,予算,掲載日時,応募期限,応募人数,採用人数,クライアント名,クライアント評価,本人確認,検索キーワード,メモ
ChatGPTを活用した社内問い合わせ対応チャットボット開発,https://example.com/jobs/sample-001,社内向けFAQチャットボットの開発,"OpenAI APIを利用した社内問い合わせ対応チャットボットを開発できる方を募集します。予算:20万円〜40万円 応募期限:2026年8月10日 応募人数:3 採用人数:1 クライアント名:株式会社サンプル",固定報酬制,アプリ・システム開発,20万円〜40万円,2026-07-01,2026-08-10,3,1,株式会社サンプル,4.8,1,ChatGPT,
Googleスプレッドシート×GASによる業務自動化,https://example.com/jobs/sample-002,請求書自動作成の自動化,"Google Apps Scriptを用いて請求書を自動作成する仕組みを構築してほしいです。予算:5万円 応募期限:2026年7月25日 クライアント名:個人事業主A",固定報酬制,業務効率化・自動化,50000,2026-07-05,2026-07-25,5,1,個人事業主A,4.5,1,Google Apps Script,
コーポレートサイトのWordPress構築,https://example.com/jobs/sample-003,コーポレートサイト新規制作,"WordPressでコーポレートサイトを制作していただける方を探しています。予算:15万円〜25万円 応募期限:2026年8月1日 クライアント名:合同会社サンプル２",プロジェクト,Web制作,15万円〜25万円,2026-07-08,2026-08-01,8,1,合同会社サンプル２,4.2,0,WordPress,要問い合わせ
ECサイト商品データのデータ入力・リサーチ,https://example.com/jobs/sample-004,商品データ入力作業,"ECサイトに掲載する商品情報のデータ入力とリサーチをお願いします。予算:3万円 応募期限:2026年7月20日 クライアント名:株式会社サンプルEC",タスク,データ入力・リサーチ,30000,2026-07-03,2026-07-20,12,3,株式会社サンプルEC,3.9,1,データ入力,
LINE公式アカウント連携の予約システム開発,https://example.com/jobs/sample-005,LINE連携予約システム,"LINE公式アカウントと連携した予約管理システムを開発してほしいです。予算:30万円〜50万円 応募期限:2026年8月15日 クライアント名:株式会社サンプルストア",固定報酬制,アプリ・システム開発,30万円〜50万円,2026-07-10,2026-08-15,2,1,株式会社サンプルストア,4.9,1,LINE連携,注目案件
